"subject","version","assignmentId","instructions_time","total_time","gender","s1_bonus","use_s1","write_down","comments","tr_choices","tr_rt","tr_resp","tr_resp2","tr_resp_correct","tr_resp2_correct","stamp","id"
"A1AFRYNDQUCO1L","cs_wg_rev_conf_v3_real1","30OG32W0SUC99LGEVNKUFDOFCX6NEK","520552","1591410","Male","1136","No","No","Just tried to remember as best as I could.  There wasn't much time",NULL,NULL,NULL,NULL,"[""Volcano: There is a volcano currently in Hawaii"",""Sunburn: I get sunburn quickly"",""Lizard: There is a lizard in Florida"",""Airbag: My car got an airbag recall"",""Wizard: I am a fantasy football wizard"",""Bicycle: I recently threw out a bicycle"",""Banana: A banana is a healthy snack"",""Basket: I like a colorful basket"",""Blanket: I need a warm blanket in the winter"",""Pelican: I've never seen a live pelican"",""Potato: I love a baked potato""]","[""blanket"",""potato"",""pelican"",""volcano"",""basket"",""lizard"",""wizard"",""bicycle"",""can't remember"",""can't remember"",""can't remember""]","2018-10-22 14:52:50","8301"
"A3NV7BWSJS3RM1","cs_wg_rev_conf_v3_real1","3GD6L00D3SY472127YAFVEGLIYTM11","514291","1273471","Male","968","No","No","No comments",NULL,NULL,NULL,NULL,"["" Wizard.  The wizard directed me to go north."",""Tomato.  I want a tomato sandwich."",""Scuba.  I like to go suba diving."",""Avocado. I like to add avocado to my sandwich"",""Banana.  I eat bananas like a monkey."",""Cowboy.  The cowboy fought the indians."",""Potato.   I do not like to eat potato salad."",""Pelican.  The pelican sat on the dock near the beach."",""Blanket.  The red blanket keeps me warm at night."",""Rocket.  The rocket flew in the sky."",""Palace.  The palace is very big.""]","[""Wizard"",""Pelican"",""Palace"",""Scuba"",""Can't remember"",""Can't remember"",""Can't remember"",""Can't remember"",""Can't remember"",""Can't remember"",""Can't remember""]","2018-10-22 14:53:35","8302"
"A3E1403CWJPCIU","cs_wg_rev_conf_v3_real1","3X73LLYYQ1FLTV7GLOS00GLS4DTNHV","332608","1122864","Male","352","No","No","I didn't have a strategy.",NULL,NULL,NULL,NULL,"[""HOCKEY: I have friends who watch hockey."",""AIRBAG: Airbag is in my car and in a prior accident it saved my life."",""LIQUID: I drink many liquids each day of my life."",""COOKIE: Cookie's are delicious and sometimes i eat them.""]","[""HOCKEY"",""AIRBAG"",""LIQUID "",""QUILT""]","2018-10-22 14:54:21","8303"
"A2NG4CG2WSIKZ6","cs_wg_rev_conf_v3_real1","31JLPPHS2UVOH80T7I3BBBKNBIOO3C","151375","689929","Female","366","No","No","I panicked I waited to think about which on I would pick until the timer started... I should have planned ahead before clicking forward.",NULL,NULL,NULL,NULL,"[""Donkey: I know several people who act like a donkey."",""Wizard: i love harry Potter movies"",""Whisker, my husband has a beard"",""Adult: my least favorite thing to do""]","[""Donkey"",""Wizard"",""Whisker"",""Adult""]","2018-10-22 14:55:21","8304"
"A1SIJPO6DB6NHY","cs_wg_rev_conf_v3_real1","31T4R4OBOSH5924DJPXATS2MR6M7CY","1144297","2341376","Male","1066","No","No","Great survey. Thanks. Group words.",NULL,NULL,NULL,NULL,"[""I am a adult"",""I need a basket"",""I want a rocket"",""The volcano erupted"",""I want a tomato"",""Life is like a avocado"",""A lizard has stripes"",""I like that bicycle"",""I have a pet pelican"",""He likes a banana for lunch"",""You are such a cowboy""]","[""basket"",""rocket"",""tomato"",""alvacado"",""volcano"",""pelican"",""cowboy"",""banana"",""cant remember"",""cant remember"",""cant remember""]","2018-10-22 14:56:29","8305"
"A36WMK9XR6NT3N","cs_wg_rev_conf_v3_real1","3ZQIG0FLQEHGYQBEIE0RB0PS54CVWO","145143","972557","Female","357","No","No","just write what word I could remember first",NULL,NULL,NULL,NULL,"[""VOLCANO: I saw the volcano in Hawaii"",""Cricket: I can hear the cricket chirping outside."",""DONKEY: I saw a donkey at the petting zoo."",""Skunk: I saw the skunk in the woods.""]","[""Volcano"",""Donkey"",""Cricket"",""skunk""]","2018-10-22 14:56:40","8306"
"A3535BGYFACXQP","cs_wg_rev_conf_v3_real1","3KJYX6QCM9CUS6BFBFHCMAVK386VJW","310210","1157696","Female","1120","No","No","Remembering the words, typing some of them out, and then looking at the third to last letter in the notepad provided. Many of the words had very early in the alphabet letters and were easy to eliminate.",NULL,NULL,NULL,NULL,"[""BANANA: My blue tongue skink loves banana."",""MONKEY: I want a monkey tailed skink."",""ACROBAT: I use acrobat reader to view PDF files."",""CANCER: My grandmother died from cancer."",""AIRBAG: My car has an airbag to save me in a crash."",""ROCKET: I built a rocket as a kid in science class and we flew them outside."",""LIZARD: I have a bearded dragon and he is an awesome lizard."",""PALACE: I have never been to a palace."",""WIZARD: Harry Potter is a book series I love about a wizard."",""HOUSE: I live in a house."",""GRENADE: I have never seen a real grenade.""]","[""Banana"",""Grenade"",""Wizard"",""Lizard"",""Palace"",""House"",""Monkey"",""Rocket"",""Airbag"",""Can't remember"",""Can't remember""]","2018-10-22 14:57:04","8307"
"A2G187XF3JMMKE","cs_wg_rev_conf_v3_real1","3Q5ZZ9ZEVOGOAV0HEK28TMS7A9658B","1330392","2616541","Female","1080","No","No","trying to remember any word fast",NULL,NULL,NULL,NULL,"[""PELICAN: My grandma lives next to pelican lake. "",""AIRBAG: My car has an airbag."",""CHICKEN: We eat a lot of chicken for dinner."",""LIZARD: When I was little I always wanted a pet lizard."",""WIZARD: Harry Potter is a wizard."",""CRICKET: My friend can make cricket noises."",""PALACE: If I were a princess I would live in a palace."",""ACROBAT: I don't know anyone that is an acrobat."",""COWBOY: My cousin thinks he is a cowboy."",""SEAGULL: I have been pooped on by a seagull."",""VOLCANO: A volcano recently erupted in Hawaii.""]","[""pelican"",""wizard"",""lizard"",""volcano"",""seagull"",""cowboy"",""can't remember"",""can't remember"",""can't remember"",""can't remember"",""can't remember""]","2018-10-22 14:57:40","8308"
"A15J06TW4K70H1","cs_wg_rev_conf_v3_real1","3VW6495TLJ11RP1J2Q5Z3WE2YTGYY1","515076","1416735","Male","357","No","No","no",NULL,NULL,NULL,NULL,"[""HOCKEY: I played hockey when i was young."",""HOUSE: I live in a big house."",""BAKER: My aunt is a baker."",""GRENADE: I work hard.""]","[""grenade"",""house"",""hockey"",""baker""]","2018-10-22 14:58:00","8309"
"A24BGPSHNP81J2","cs_wg_rev_conf_v3_real1","3M23Y66PO282CJF4X1II2J68IYQS6G","374726","2113516","Female","1038","No","No","Trying to remember the words as best as I could. ",NULL,NULL,NULL,NULL,"[""WIZARD: A wizard is a mythical being."",""POTATO: A potato is yummy."",""MOUSE: I saw a mouse run under the door."",""DONKEY: Jesus rode a donkey."",""LIZARD: That lizard was green. "",""COWBOY: Cowboy up and get to it. "",""AVOCADO: I would like to eat an avocado."",""NAPKIN: Please pass me the napkin."",""ACROBAT: That acrobat went flying through the air."",""VOLCANO: Better make sure the volcano doesn't erupt."",""BANANA: A Banana has a lot of potassium. ""]","[""Wizard"",""Potato"",""Volcano"",""Lizard"",""Donkey"",""Mouse"",""Avocado"",""Banana"",""Can't remember"",""Can't remember"",""Can't remember""]","2018-10-22 15:00:51","8311"
"A1SMJPKHJLZRC9","cs_wg_rev_conf_v3_real1","304SM51WA358IVWZTSZQDZS0WZWBSF","1271660","2042862","Female","887","No","No","I just thought of Adult and u is late in the alphabet.",NULL,NULL,NULL,NULL,"[""I have a friend that is a great baker."",""I love to eat a baked potato."",""Some of my relatives and friends have had cancer."",""When I was a child I loved to watch the Wizard of Oz."",""I like to watch the acrobats perform in Las Vegas."",""My car has dual air bags."",""I love to bake Christmas cookies."",""I like to watch cowboy movies sometimes."",""I love avocados. "",""I bought my daughter a bicycle for Christmas one year."",""I am an adult.""]","[""Bicycle"",""Avacado"",""Cancer"",""Adult"",""Potato"",""baker"",""cookie"",""Wizard"",""Can't remember"",""Can't remember"",""Can't remember""]","2018-10-22 15:00:53","8312"
"A2TLQXGIO2LJ91","cs_wg_rev_conf_v3_real1","32SCWG5HIH55ZRZC5KEO7E1XVEKP6Y","174728","776197","Female","366","No","No","I just ran the words through my head.  They are short words, so it wasn't a big deal, but perhaps I got it wrong, so who knows?",NULL,NULL,NULL,NULL,"[""MARKET: I shop at a market."",""MONKEY: The kids I teach act like monkeys. :)"",""Palace: The Palace of Versailles is in France."",""SQUID: Squidward is a squid.""]","[""Market"",""Monkey"",""Palace"",""Squid""]","2018-10-22 15:01:14","8313"
"COPIEDA21DMNJAFPOV1Y
Hello, William Garner  |  Sign Out
COPIEDA21DMNJAFPOV1Y
Hello, William Garner  ","cs_wg_rev_conf_v3_real1","31T4R4OBOSH5924DJPXATS2MR6NC74","745587","2378979","Male","1140","No","No",,NULL,NULL,NULL,NULL,"[""hockey i have played hockey"",""pumpkin i eat pumpkin pie"",""avocado avocado are great with tacos"",""cowboy cows and cowboy go good"",""lizard he had to free his lizard"",""sauce you can have some sauce on food items"",""grenade i was trained to use a grenade"",""banana she likes to eat banana"",""palace you can place game parts on a borad"",""bicycle i will run away on my bicycle"",""tomato tomato on a sub is great""]","[""lizard"",""bicycle"",""hockey"",""banana"",""place"",""cowboy"",""grenade"",""pumpkin"",""tomato"",""avocado"",""sauce""]","2018-10-22 15:01:33","8314"
"A2EDGL9NBR4G4N","cs_wg_rev_conf_v3_real1","34HJIJKLP5X4POSU88U8G861LBHV46","312805","1127360","Female","356","No","No","I tried to quickly rethink my 4 words. Making it I best guess. I also though the last question was tricky. I only put in my 4 words and not the sentences.",NULL,NULL,NULL,NULL,"[""BUCKET, I have a big bucket of ice."",""SCUBA, I would like to learn to scuba dive."",""COWBOY, I was a cowboy for trick or treat when I was 9."",""PUMPKIN, I carved pumpkin faces last night.""]","[""bucket"",""scuba"",""pumpkin"",""cowboy""]","2018-10-22 15:03:28","8315"
"A3X3UFGLKM36R","cs_wg_rev_conf_v3_real1","3VZLGYJEYLBCWALETGLGYPGV2HRXZM","623781","1574220","Male","1108","Yes","No","ONly had enough time to enter the first word I could think of that was not avocado",NULL,NULL,NULL,NULL,"[""WHISKER: I seen a cat walk by more door yesterday and I noticed his long whiskers."",""ACROBAT: I am not very acrobatic so this one will be easy to relate to."",""AVOCADO: I dislike Avocado and everyone thinks I am crazy."",""LIZARD: There are many lizards in Florida."",""AIRBAG: Airbags are important in saving lives."",""POTATO: I always struggle to decide to buy instant potatoes or natural ones."",""GRENADE: I wish there were no such thing as a grenade in this world."",""PALACE: The supermarket in the neighborhood I grew up was named the Palace."",""ADULT: I visited an Adult Website yesterday."",""PUMPKIN: Halloween is nearing and I cannot decide whether or not I'd like to set out a pumpkin or two."",""TOMATO: I'm always dissapointed when I order food and there are tomatoes on it""]","[""Tomato "",""Potato"",""Pumpkin"",""Palace"",""Adult"",""Avocado"",""Lizard"",""Whiskers"",""Cant Remember"",""Cant Remember"",""Cant Remember""]","2018-10-22 15:04:05","8316"
"AY1W6JDJ71ZMA","cs_wg_rev_conf_v3_real1","32SCWG5HIH55ZRZC5KEO7E1XVEJP6X","987599","2256331","Female","1040","No","No","think of the the thirsd letter of each work",NULL,NULL,NULL,NULL,"[""TOMATO: I have a tomatoe plant"",""Cancer:  I do not have cancer"",""Pumpkin:  I like the flavor of pumpkin"",""sauce:  I use many different kinds of sauce when cooking."",""volcano: I have visited the site of a volcano."",""grenade:  I have not seen a grenade explode."",""acrobat:  I have seen an acrobat perform."",""baker:  I am a good baker."",""Palace:  I have visited a palace."",""avacado:  I put an avacado in my salad"",""potatoe: I made a potatoe dish for dinner last night""]","[""tomato"",""cancer"",""volcano"",""acrobat"",""grenade"",""avacado"",""palace"",""potatoe"",""sauce"",""bake"",""can't remember""]","2018-10-22 15:04:36","8317"
"A1IYIHAVTI87MK","cs_wg_rev_conf_v3_real1","34YB12FSQYP1BHR5PHVI21KRKNEGMX","259045","970285","Male","372","No","No","say all the words I could remember and asked myself how to spell them. It worked like a charm.",NULL,NULL,NULL,NULL,"[""BAKER: I bake with my mom."",""SQUID: I like the ocean."",""ROCKET: The Houston Rockets."",""LIZARD: My brother had a lizard.""]","[""BAKER"",""SQUID"",""ROCKET"",""LIZARD""]","2018-10-22 15:04:48","8318"
"A1E0FAA3PFCMF5","cs_wg_rev_conf_v3_real1","3SKEMFQBZ36RSELKL76EVBBP7Z88K6","192764","901744","Male","372","Yes","No","remembering the first letter of each word.",NULL,NULL,NULL,NULL,"[""cricket is my wireless provider"",""ika is squid in japanese"",""napkin is what you put on your lap"",""cancer is not good.""]","[""napkin"",""cricket"",""cancer"",""squid""]","2018-10-22 15:10:12","8319"
"AMMM0FRS871OK","cs_wg_rev_conf_v3_real1","3WOKGM4L71HS0G1WOVLS9DMG864O0H","520101","1583653","Female","1094","Yes","No","I thought of the word that I thought would give me the most points. For instance rocket, the third-to-last letter is a 'k' so I knew that would get me more points rather than banana.",NULL,NULL,NULL,NULL,"[""I use rocket in my deck on clash royale. "",""I am terribly scared of a lizard"",""A penguin is a cute little animal I saw in a zoo"",""My cousin once did acrobat. "",""My grandmother had breast cancer."",""I don't really like when my boyfriend eats a tomato. "",""I love to eat a banana for breakfast. "",""My son gets to dress like a cowboy tomorrow for school (no joke!)"",""I recently put a bucket in my van so my kids would stop throwing their trash on the floor."",""My sons love to build me a palace out of their legos."",""I don't really relate with an avocado other than to make guacamole for my boyfriend.""]","[""rocket"",""cancer"",""avocado"",""tomato"",""banana"",""palace"",""cowboy"",""can't remember"",""can't remember"",""can't remember"",""can't remember""]","2018-10-22 15:10:15","8320"
"A1EX9PH5R5V4IX","cs_wg_rev_conf_v3_real1","3X73LLYYQ1FLTV7GLOS00GLS4D0HNW","483044","1482486","Male","1103","Yes","No","Cool study.. I didn't really have a strategy",NULL,NULL,NULL,NULL,"[""BASKET:My son uses for Easter."",""WHISKER:My cat has whiskers"",""POTATO:I ate potato fries at mcdonalds"",""CANCER:I know somebody with cancer"",""ACROBAT:My sister is a acrobat"",""WIZARD:I play as a wizard in a videogame"",""SCUBA:I went scuba diving in flordia"",""PELICAN:I fed pelicans in flordia"",""AVOCADO:I ate one last night "",""LIZARD:I saw a lizard in my backyard "",""BANANA:I love bananas  ""]","[""Cancer"",""acrobat"",""potato"",""pelican "",""avocado"",""wizard"",""lizard"",""whisker "",""Can't remember"",""Can't remember"",""Can't remember""]","2018-10-22 15:11:10","8321"
"A16E0XDNK8KX5Y","cs_wg_rev_conf_v3_real1","3WI0P0II61TPWDU6SZQRIFB4DIXRDM","456202","1419864","Female","1140","No","No","I just listed as many words as I could remember in the short time limit and chose from there which had the latest letter in the alphabet which happened to be donkey.",NULL,NULL,NULL,NULL,"[""POTATO: I like to eat potato chips"",""TOMATO: I hate tomatoes"",""CRICKET: I enjoy the character Rickety Cricket on It's Always Sunny in Philadelphia"",""VOLCANO: I am scared of volcanoes"",""DONKEY: I like the character Donkey in the Shrek movies"",""LIZARD: I used to catch lizards as a kid"",""THUMB: I once slammed my thumb in a car door"",""COWBOY: I like the Cowboy character in Muholland Drive"",""PELICAN: I saw a pelican at the beach"",""PALACE: I visited a palace in Europe"",""AVOCADO: I made avocado toast with a poached egg""]","[""Potato"",""Tomato"",""Cricket"",""Can't remember"",""Can't remember"",""Donkey"",""Volcano"",""Lizard"",""Cowboy"",""Palace"",""Avocado""]","2018-10-22 15:12:21","8322"
"A1HYPREIYKTEVB","cs_wg_rev_conf_v3_real1","34J10VATJFZ6SNVS7Y224MHC913QIM","392530","1466126","Male","348","No","No","Monkey was the only word I could think of in 20 seconds. and the K is third-to-last letter.",NULL,NULL,NULL,NULL,"[""I saw a mouse in my garage one time."",""I used a basket to put my clothes in. "",""I played with a monkey in thailand last year."",""I prefer an avocado on my sandwiches. ""]","[""Mouse"",""Monkey"",""Basket"",""Avocado ""]","2018-10-22 15:15:03","8324"
"A1KRDMJ471H2RH","cs_wg_rev_conf_v3_real1","3KWTYT08704JP2K089BCYREDU9CL5K","385325","1172989","Female","1039","No","No","I couldn't answer it. No strategy.",NULL,NULL,NULL,NULL,"[""Cricket. I used to catch a cricket and put it in a jar as a child."",""Cowboy. My cousin writes professionally about cowboy culture. "",""Wizard. I used to be obsessed with Merlin the wizard."",""Tomato. I am kind of allergic to tomato."",""Palace. Princesses always live in a palace, right?"",""Blanket. I have been using the blanked to stay warm all morning. "",""Banana. My kidneys aren't supposed to process potassium in banana products very well. "",""Acrobat. I loved to watch the acrobat in Las Vegas. "",""House. Things are always breaking around my house and my husband is slow to fix them."",""Lizard. When I as staying in Florida, there was a lizard lost in the home. "",""Avocado. Avocado is a good fat that I love in burritos. ""]","[""avocado"",""lizard "",""house "",""acrobat"",""tomato"",""Can't remember"",""Can't remember"",""Can't remember"",""Can't remember"",""Can't remember"",""Can't remember""]","2018-10-22 15:15:34","8326"
"APUO9YF36ARSN","cs_wg_rev_conf_v3_real1","39PAAFCODM1O697KN9VGOGIT1AYVT2","1158634","1829643","Female","371","No","No","I just thought of the words from part one and pictured them in my head. I then compared the 3rd to last letter and mouse seemed to be the correct answer. ",NULL,NULL,NULL,NULL,"[""COOKIE: I don't enjoy chocolate cookies. "",""Cowboy: I like to watch cowboy movies."",""Mouse: It scares me if there is a mouse in the house."",""Hockey:I have never played hockey.""]","[""Cookie"",""Cowboy"",""Hockey"",""Mouse""]","2018-10-22 15:16:58","8327"
"A1SJ4EZTJFESUU","cs_wg_rev_conf_v3_real1","3UJ1CZ6IZHQ6TFFQSI8DADS8M3JS54","804955","1743658","Female","1009","No","No","I tried to think of all of the words and spell them in my head.  My strategy did not work well.",NULL,NULL,NULL,NULL,"[""Palace: I would love to live in a palace."",""Cowboy: Someday I will meet a real live cowboy."",""Monkey: My children jump around like a monkey in a cage."",""Market: I try to avoid going to the market."",""Pelican: I do not have a pet pelican.\n"",""Scuba: I will never scuba dive."",""Grenade: Throwing a grenade gave me a rush."",""Airbag: Thank God my car is equipped with more then one airbag."",""Volcano: Avoid Hawaii because of the volcano."",""Bicycle: I want to ride my bicycle."",""Wizard: I have never met a real wizard.""]","[""Wizard"",""Bicycle"",""Pelican"",""Volcano"",""Cowboy"",""Monkey"",""Scuba"",""can't remember"",""Can't remember"",""Can't remember"",""Can't remember""]","2018-10-22 15:17:31","8328"
"A1TFWBB1WWH6WZ","cs_wg_rev_conf_v3_real1","3SUWZRL0MYE120AMW6YDD22TH7P6E1","132356","640257","Female","360","No","No","visualized all the words in my mind",NULL,NULL,NULL,NULL,"[""cookie: sweets i dont really like"",""grenade; ron swason decoration"",""donkey; don quiote"",""skunk; in lake george""]","[""grenade"",""cookie"",""donkey"",""skunk""]","2018-10-22 15:18:50","8330"
"A3G4XQQF2QW8X9","cs_wg_rev_conf_v3_real1","3PXX5PX6LXZ4IZA5CSDZSZYUATYBAS","308867","1172852","Female","1134","Yes","No","I completely blacked out on the question and didn't have time to answer.",NULL,NULL,NULL,NULL,"[""CANCER: My grandmother almost died from breast cancer."",""MARKET: I love going to the market."",""GRENADE: Grenades are dangerous."",""VOLCANO: Hawaii is full of volcano."",""PELICAN: I haven't seen a pelican up close."",""AIRBAG: Cars must have airbag."",""BUCKET: A bucket full of candies is what I need on Halloween."",""ACROBAT: Someday I want to say an acrobat show."",""LIZARD: I don't like seeing a lizard in my room."",""LIQUID: I prefer my foundations in liquid form."",""BICYCLE: A lot of our neighbors say my bicycle is cute.""]","[""CANCER"",""MARKET"",""GRENADE"",""VOLCANO"",""PELICAN"",""AIRBAG"",""BUCKET"",""ACROBAT"",""LIZARD"",""LIQUID"",""BICYCLE""]","2018-10-22 15:20:25","8331"
"A23C24804TMAXT","cs_wg_rev_conf_v3_real1","38F5OAUN5NDWQAFT5HBB4JZ24YYH7O","523528","1700675","Female","1147","No","No","i could not answer that part.",NULL,NULL,NULL,NULL,"[""i love to watch cricket"",""once my airbag exploded"",""someone i know have cancer"",""I plant Tomato in my garden"",""my kid is a computer wizard"",""i went to market yesterday"",""banana is very cheap"",""i like avocado"",""I like to see acrobat"",""I dont know to ride a bicycle"",""my house is in a beautiful place""]","[""cricket"",""house"",""bicycle"",""avocado"",""acrobat"",""wizard"",""airbag"",""banana"",""market"",""cant remember"",""cant remember""]","2018-10-22 15:21:53","8332"
"A1RWNYJA5X25YH","cs_wg_rev_conf_v3_real1","3C6FJU71TQUKAGHESP8A0B8P259UY3","847909","1868998","Female","1044","No","No","I did not have one and couldn't think fast enough",NULL,NULL,NULL,NULL,"[""MY CAT HAS A WHISKER."",""I ATE A BANANA."",""MY HOME IS MY PALACE."",""I WALK ON THE GROUND."",""I HAVE A BICYCLE."",""I LIKE TO WATCH COWBOY MOVIES."",""I WOULD LIKE TO SEE A VOLCANO."",""I USE A NAPKIN WHEN I EAT DINNER."",""I ATE A POTATO FOR LUNCH."",""I WOULD LIKE TO SEE AN ACROBAT."",""I HAVE A LIZARD IN MY YARD.""]","[""BANANA"",""COWBOY"",""VOLCANO"",""LIZARD"",""NAPKIN"",""BICYCLE"",""GROUND"",""ACROBAT"",""WHISKER"",""POTATO"",""Can't remember""]","2018-10-22 15:26:53","8335"
"A1BE65I3AW2ZQX","cs_wg_rev_conf_v3_real1","3V0Z7YWSIY1UMAD74UBKNT931XMV2B","678725","1296661","Female","340","Yes","No","It was to make sure that I knew the position of the letters in the alphabet. So A was 1 and so on and so forth.",NULL,NULL,NULL,NULL,"[""CRICKET The men played Cricket in Great Britain."",""BAKER. The baker baked cookies."",""SAUCE. The sauce was delicious."",""AVOCADO. The avocado was perfect to make dip with.""]","[""Cricket"",""Baker"",""Sauce"",""Avocado""]","2018-10-22 15:27:22","8336"
"A2S0Z17XUCYM6N","cs_wg_rev_conf_v3_real1","32Z9ZLUT1LL3BG7SM3SDF5LXUN8HOE","802826","1987741","Male","1113","No","No","no",NULL,NULL,NULL,NULL,"[""Banana: I love peanut butter and banana sandwiches."",""Cricket: Crickets are very loud at my house in the summertime."",""Airbag: My granny had an airbag almost break her nose once."",""Wizard: I sometimes read books with wizards in them."",""Avocado: I love almost anything with avocado."",""Tomato: Vine ripe tomatoes are one of my favorite things in the summer."",""Acrobat: I once went to see acrobats in Atlanta."",""Lizard: I used to have many lizards when I was a child."",""Adult: Being and adult is sometimes difficult but at least you can eat ice  cream for dinner if you want."",""Basket: My mom likes baskets and has many different kinds."",""Grenade: I have held an inactive grenade before.""]","[""banana"",""airbag"",""lizard"",""basket"",""granade"",""tomato"",""avocado"",""acrobat"",""wizard"",""Can't remember"",""Can't remember""]","2018-10-22 15:27:28","8337"
"A29MXEKPLHDJ1O","cs_wg_rev_conf_v3_real1","3R6BYFZZP7D6RTUES4R9VX0DQC3FXM","175543","760059","Male","372","Yes","No","I picked house, because it was u",NULL,NULL,NULL,NULL,"[""Tomato- I love tomato ketchup"",""House- I live in a house"",""Donkey- I rode a donkey"",""Blanket- I sleep with a blanket""]","[""Tomato"",""Blanket"",""House"",""Donkey""]","2018-10-22 15:29:37","8340"
"AX3MVCU5MEFED","cs_wg_rev_conf_v3_real1","3EFVCAY5L3AWHUF23M62UWBCSAB8JA","385778","1275774","Female","1127","No","No","type one of the words and hope for the best",NULL,NULL,NULL,NULL,"[""BICYCLE: My dad taught me how to ride a bike"",""Grenade: My brother always plays war video games"",""Blouse: I'm addicted to shopping for new clothes"",""Volcano: I went to Hawaii two years ago"",""Palace: I like to dream of what it would be like to be a princess"",""BLANKET:I have a childhood blanket still"",""BANANA: Reminds me of monkeys and I love monkeys"",""Cancer: My neighbor recently was diagnosed"",""Tomato: I hate tomatos"",""Airbag: Reminds me of the new car I bought"",""MONKEY: One of my favorite animals""]","[""monkey"",""banana"",""grenade"",""bicycle"",""palace"",""volcano"",""airbag"",""cant remember"",""cant remember"",""cant remember"",""cant remember""]","2018-10-22 15:32:25","8342"
"A366JCV00ETS7V","cs_wg_rev_conf_v3_real1","30BXRYBRP4YBGPGUDPJNWZYJXPCHWV","219995","861038","Female","346","No","No","I had no issues with the study, everything was explained very well.
I didn't have a strategy for the third-to-last letter question. I had a brain freeze at first, but then I ran through the list of words out loud and found it a bit easy.",NULL,NULL,NULL,NULL,"[""I like wizards because they are in the Harry Potter movies."",""I have never played the sport or game cricket before."",""Squid is a type of fish with many legs, I find them frightening. "",""I would not consider myself a good cook or a good baker.""]","[""wizard"",""cricket"",""squid"",""baker""]","2018-10-22 15:36:16","8346"
