"subject","version","assignmentId","instructions_time","total_time","gender","s1_bonus","use_s1","write_down","comments","tr_choices","tr_rt","tr_resp","tr_resp2","tr_resp_correct","tr_resp2_correct","stamp","id"
"ANBJ5DIMTXUZG","cs_wg_rev_conf_v2_real1","39K0FND3AHG01QE23H386F9OKOMMA2","458985","1498600","Male","634","No","No","none",NULL,NULL,NULL,NULL,"[""WHISKER:My cat has a whisker"",""HOCKEY : I like to watch hockey "",""SAUCE : My spaghetti sauce is the best "",""VOLCANO :The volcano may erupt "",""NAPKIN:Please use napkin provided ""]","[""HOCKEY "",""NAPKIN "",""SAUCE "",""WHISKER "",""VOLCANO ""]","2018-10-15 14:22:37","7988"
"AH7OEV8AGD4BF","cs_wg_rev_conf_v2_real1","3WQQ9FUS6AVQZBHQFUTLW8SZI1J8BW","441734","1512806","Female","616","No","No"," No comments.   No strategy just did the best I could to come up with best answer",NULL,NULL,NULL,NULL,"[""I would like to see a volcano in person"",""When I was a kid I used to catch crickets"",""My cat has long whiskers"",""I like the song rocket man"",""My right thumb hurts""]","[""rocket"",""thumb"",""whiskers"",""volcano"",""cricket""]","2018-10-15 14:24:17","7989"
"AGDKM3CF6Q74J","cs_wg_rev_conf_v2_real1","3WSELTNVR334EL4MCE4KST4GEWITAA","669580","1972564","Female","1203","No","No","Nothing, I couldn't think that fast, I was going to try to list them in my head.  It was fun but, hard.",NULL,NULL,NULL,NULL,"[""I used to love playing street hockey."",""My favorite cookie is chocolate chip."",""I love a cold tomato with just a sprinkle of salt in the summer. "",""The wizard on Lord of the Rings is cool."",""I have never seen a jaguar in real life."",""Hawaii had that volcano eruption."",""I think being an acrobat would be fun."",""I love avocado."",""I wish I lived in a palace."",""I have only seen a pelican once at the beach."",""Potato is a great blank canvas to cook with."",""I don't know how people can eat a cricket.""]","[""Hockey"",""Cookie"",""Avocado"",""Tomato"",""Potato"",""Palace"",""Pelican"",""Wizard"",""Jaguar"",""Cricket"",""can't remember"",""can't remember""]","2018-10-15 14:24:46","7990"
"AO8O12ULT1Y15","cs_wg_rev_conf_v2_real1","3TMFV4NEP8FINEF1ALPHJM5KS2ZW8Y","461081","1193845","Male","1071","Yes","No","ITS VERY DIFFICULT",NULL,NULL,NULL,NULL,"[""COOKIES IS MY FAVORITE COOKIE"",""PALACE IS MY DREAM"",""TOMATO IS DELICIOUS VEGETABLE"",""WIZARD IS COMING IN MY CHILDHOOD DREAM"",""PELICAN IS GOOD FOR HEALTH "",""VOLCANO IS NATURES BEAUTY"",""WHISKER IS NOT IN MY LIFE "",""I AM LIKE COWBOY MOVIES"",""SMOKING CREATES THE CANCER DISEASE "",""DONKEY IS WELL ANIMAL"",""GRENADE  IS NO WELL FOR ME "",""SCUBA IS MY ENTERTAINMENT ""]","[""COOKIE"",""PALACE"",""TOMATO "",""WIZARD"",""PELICAN"",""VOLCANO "",""WHISKER "",""COWBOY"",""DONKEY"",""CANDER"",""DON'T KNOW"",""DON'T KNOW""]","2018-10-15 14:27:12","7991"
"A1SQK9J346UIXK","cs_wg_rev_conf_v2_real1","3B2X28YI3WG3VXY2MFWNCUW8C6S6B7","331857","1770417","Male","1205","Yes","Yes","THIS SURVEY IS NICE...........",NULL,NULL,NULL,NULL,"[""CRICKET"",""ACROBAT"",""BUCKET"",""NAPKIN"",""BANANA"",""BICYCLE"",""JAGUAR"",""CANCER"",""POTATO"",""COWBOY"",""PALACE"",""GRENADE""]","[""can't remember"",""can't remember"",""can't remember"",""can't remember"",""can't remember"",""can't remember"",""can't remember"",""can't remember"",""can't remember"",""can't remember"",""can't remember"",""can't remember""]","2018-10-15 14:27:32","7992"
"A1PT8E2MD4B6BA","cs_wg_rev_conf_v2_real1","3ZR9AIQJUBAOWNRE5B6JVFGBPBP40Y","359235","1475575","Female","642","No","No","No comments about study (it was actually quite fun to complete). My strategy for the third to last letter question was to say each word out loud with particular emphasis on the ending Wiz-ard, Mar-ket, etc. Wizard was the most deceiving of the words because of the Z, with Blouse actually being the highest scoring word option while the other three all were 'K' words.",NULL,NULL,NULL,NULL,"[""Blouse: I wear a blouse to work."",""Market: Some companies use Facebook to market their products."",""Blanket: In winter, we use extra blankets on our bed because it is cold."",""Monkey: We went to the zoo and saw a monkey."",""Wizard: I think I want to dress up as a wizard this year for Halloween.""]","[""Blouse"",""Market"",""Blanket"",""Monkey"",""Wizard""]","2018-10-15 14:27:38","7993"
"A3152I7PKN85C6","cs_wg_rev_conf_v2_real1","3RXCAC0YIRQMQSP1VGLZXJJWYEAG8K","269672","2246068","Male","642","No","No","I thought it out in my head",NULL,NULL,NULL,NULL,"[""POTATO: I used to farm potatoes"",""BAKER: I got fresh bread from the baker"",""MONKEY: My kids behave like monkeys"",""CRICKET: I listen to the cricket at night"",""GROUND: I grow a graden in the ground""]","[""Baker"",""Potato"",""Cricket"",""Ground"",""Monkey""]","2018-10-15 14:28:06","7994"
"A385NIOXWWGE99","cs_wg_rev_conf_v2_real1","3E47SOBEYQX2YML92G17KHSV3IRICO","541423","1551529","Male","1258","No","No","Just tried to remember literally any of the words. ",NULL,NULL,NULL,NULL,"[""Lizard: Lizards are scary. "",""Hockey: Ice sport for skating and hitting people. "",""Grenade: A good weapon on MW2 is a grenade. "",""Avocado: I would hate to eat an avocado. "",""Palace: Alladin lived in a palace later on. "",""Cookie: Cookie monster has a strong addiction and needs help. "",""Pelican: Anthony Davis is a New Orleans Pelican."",""Cowboy: I can't wait for Red Dead Redemption 2 to be a cowboy."",""Pumpkin: I will carve a Pumpkin this Halloween."",""Wizard: Harry Potter is a Wizard. "",""Penguin: All I picture now next to a Penguin is Jim Carrey."",""Tomato: I would love a tomato to go on my burger. ""]","[""Lizard"",""Can't remember"",""Can't remember"",""Can't remember"",""Can't remember"",""Can't remember"",""Grenade"",""Cowboy"",""Pelican"",""Wizard"",""Penguin"",""Tomato""]","2018-10-15 14:28:51","7995"
"A2T22FJ28MIGI","cs_wg_rev_conf_v2_real1","3L0KT67Y8EH4V3PA3KDALAQ1F4HYSA","125069","709839","Male","642","No","No","Just repeating the words in my head constantly and then trying to focus on the letters",NULL,NULL,NULL,NULL,"[""I had a fry stolen by a seagull"",""My favorite snack is a cookie"",""On Halloween we usually carve a pumpkin"",""I like to watch movies featuring a cowboy"",""At the petting zoo, I interacted with a donkey""]","[""PUMPKIN"",""SEAGULL"",""COOKIE"",""COWBOY"",""DONKEY""]","2018-10-15 14:29:09","7996"
"A2S64AUN7JI7ZS","cs_wg_rev_conf_v2_real1","3VJ40NV2QIOTGPYNMX92TOOL3DLOT3","489876","1380929","Male","641","No","No","Write down the words as quickly as I could then find the one with the highest 'third-to-last letter' ",NULL,NULL,NULL,NULL,"[""Potato:  One of my favorite foods are french fries "",""Sauce:  I use hot sauce on almost everything I eat"",""Blanket:  I always check on my kids when they're sleeping to make sure they're covered with a blanket"",""Whisker:  I love watching our rabbit, her nose and whiskers moves constantly "",""Donkey:  Is my favorite Shrek character ""]","[""Potato"",""Sauce"",""Whisker"",""Blanket"",""Donkey""]","2018-10-15 14:29:48","7997"
"A1U3NKURAZY29Q","cs_wg_rev_conf_v2_real1","3Z2R0DQ0JHFDKZRL94MANPLHZY92ES","383292","1369538","Female","641","No","No","No questions for the third to last letter the bonus points was based on the position the letter holds in the alphabet for instance letter a in the third place is worth 1pt.  ",NULL,NULL,NULL,NULL,"[""NAPKIN:I use a napkin to wipe my face."",""CRICKET: I woke up to a cricket singing."",""HOUSE: I live in a house."",""WIZARD: I like to use a wizard when I create a program. "",""MONKEY: A monkey hangs from a tree. ""]","[""napkin"",""wizard"",""monkey"",""cricket"",""house""]","2018-10-15 14:29:57","7998"
"A1RR8SEXUXFE0U","cs_wg_rev_conf_v2_real1","31T4R4OBOSH5924DJPXATS2MP2C7CE","934248","2455328","Male","1121","Yes","Yes","Must be completed with in the given time.",NULL,NULL,NULL,NULL,"[""I like potato"",""I saw the rocket"",""I am going to palace"",""Volcano is very danger"",""I play hockey"",""I eat banana"",""I saw cricket match"",""I do not like lizard"",""I use wizard"",""I saw skunk"",""he is a cowboy"",""She is a cancer patient""]","[""I like cricket match"",""She is a cancer patient"",""Can't remember"",""Can't remember"",""Can't remember"",""I like potato"",""He is a cowboy"",""Can't remember"",""I play hockey"",""Can't remember"",""Can't remember"",""Can't remember""]","2018-10-15 14:30:30","7999"
"A1PD5PBOWB1PC4","cs_wg_rev_conf_v2_real1","337RC3OW0530NWZFE0TP2P8C5TXVLA","846047","2407376","Female","1277","No","No","Fun and interesting. I thought of the words in my head, unfortunately i know i got it wrong and thought of the right answer just after time ran out.",NULL,NULL,NULL,NULL,"[""Volcano it would be interesting to see a volcano."",""Jaguar, a beautiful creature from the cat family."",""Avocado, I really do not like he taste of them."",""Cancer, my husband died of lung cancer."",""Cookie, I bake a lot of cookies for my family."",""Wizard, Gandalph is a wizard in Lord of the Rings."",""Airbag, my truck is fitted with airbags to ensure safety."",""Blanket, I love a soft blanket on a old day."",""Tomato, not my favorite fruit but I love green tomatoes fried."",""Napkin, I always use a napkin when I eat."",""Pelican, a large bird that eats fish, often portrayed in Disney animated films as a bit silly."",""Potato, I have grown these and love to eat a potato with sour cream.""]","[""volcano"",""pelican"",""cancer"",""potato"",""tomato"",""avocado"",""napkin"",""jaguar"",""cookie"",""airbag"",""can't remember"",""can't remember""]","2018-10-15 14:30:41","8000"
"A3FO72CL3V3BVE","cs_wg_rev_conf_v2_real1","3IXQG4FA2TZQDG00KMZZW4NA2709BL","344046","1186076","Male","642","No","No","N/A counting",NULL,NULL,NULL,NULL,"[""whisker i have whiskers on my face"",""basket i play basket ball"",""penguin i like the movie penguins"",""market i trade stocks on the market"",""bicycle i ride a bicycle""]","[""whisker"",""basket"",""penguine"",""market"",""bicycle""]","2018-10-15 14:31:13","8001"
"A2Y1KZ2CGM7UX9","cs_wg_rev_conf_v2_real1","3M81GAB8A0KW5FHM1OALIZDZC74BQ9","1516770","2515679","Male","1043","Yes","No","very good, copy sentences with every word",NULL,NULL,NULL,NULL,"[""buy a blouse"",""buy a red tomato"",""that cricket will not let me sleep"",""that chicken was tasty"",""yesterday made erucion that volcano"",""the neighbor overcame the cancer"",""the avocado is tasty"",""tomorrow I will go to the palace"",""I saw acrobat"",""I like cowboy movies"",""I like the vanilla flavor cookie"",""grenade""]","[""I like cowboy movies"",""I like the vanilla cookie"",""That chicken is tasty"",""yesterday erupted that volcano"",""t hat avocado was tasty"",""Yesterday I ate a grenade"",""the tomato is red"",""t hat avocado was tasty"",""I like the vanilla cookie"",""the tomato is red"",""Yesterday I ate a grenade"",""I like cowboy movies""]","2018-10-15 14:33:22","8002"
"A1OB7OBC48BWSM","cs_wg_rev_conf_v2_real1","3YJ6NA41JBHHNMEJP38DGI62FGRJPB","349989","1285000","Female","1121","Yes","Yes","NO COMENTS",NULL,NULL,NULL,NULL,"[""QUILT "",""COWBOY"",""CHICKEN "",""BAKER "",""WIZARD"",""PALACE "",""PENGUIN"",""ACROBAT"",""TOMATO "",""NAPKIN"",""VOLCANO"",""AIRBAG ""]","[""QUILT "",""COWBOY"",""CHICKEN"",""BOOK"",""WORLD "",""WATER "",""FOOD "",""JUICE "",""MILK"",""FLOWER "",""MUTTON"",""AIRBAG ""]","2018-10-15 14:34:41","8003"
"A3QJBPCOVQIBSB","cs_wg_rev_conf_v2_real1","3OUYGIZWR7ZALGDX3VY7YDR6G7L0PL","303441","846224","Male","1048","No","No","nice task",NULL,NULL,NULL,NULL,"[""i bought a bicycle last year"",""i have seen cow boy movies"",""my friend is suffered from mouth cancer"",""my uncle is a baker"",""i usually saw adult movies"",""action games has grenade "",""nearby my city has volcano"",""i usually get a basket to purchase groceries"",""i have visited Beckham palace "",""in the zoo i saw a monkey"",""i got airbag in a plane for safety"",""i like acrobat""]","[""acrobat"",""monkey"",""baker"",""valcano"",""cancer"",""bicycle"",""palace"",""Can't remember"",""Can't remember"",""Can't remember"",""Can't remember"",""Can't remember""]","2018-10-15 14:35:41","8004"
"AJ3F5RR0P8LZR","cs_wg_rev_conf_v2_real1","339ANSOTR53KHKXXUTI580538R1KI4","269779","1184506","Female","1282","No","No","I just thought of whatever words I could and wrote whatever had the highest value that I could remember.",NULL,NULL,NULL,NULL,"[""Acrobat - I've never seen an acrobat."",""Lizard - I want a lizard."",""Blouse - I've worn a blouse"",""Airbag - I have an airbag in my car"",""Napkin - I don't have napkins"",""Donkey - I've never seen a real donkey."",""Palace - A palace doesn't relate to me."",""Potato - I don't like potatoes."",""bucket - I have a bucket."",""cowboy - I never wanted to be a cowboy"",""pelican - I've never seen a real pelican. "",""Banana - my bananas are going bad.""]","[""banana"",""acrobat"",""airbag"",""lizard"",""Can't remember"",""Can't remember"",""Can't remember"",""Can't remember"",""Can't remember"",""Can't remember"",""Can't remember"",""Can't remember""]","2018-10-15 14:37:15","8005"
"A1UX7O4MHJR4EG","cs_wg_rev_conf_v2_real1","3IQ1VMJRYTLLU6V8E8Z31T34KPF9AQ","1499349","2716129","Male","1041","Yes","No","NONE.IT IS INTERESTING.",NULL,NULL,NULL,NULL,"["" One Wizard is worth three Sorcerer"",""The king once lived in that palace"",""Tom thought Mary had the IQ of a lizard"","" The grenade blew up before the terrorist could throw it, and his arm was blown off! "",""Tom has been grounded."",""A pelican can fit a lot of fish in its beak."",""They launched a rocket."",""Tom loved bananas."","" I have a bicycle."",""The airbag saved my life."","" Tom likes hockey."","" Tom baked his wife a pumpkin pie.""]","[""WIZARD"",""PALACE"",""LIZARD"",""GRENADE"",""GROUND"",""PELICAN"",""ROCKET"",""BANANA"",""BICYCLE"",""AIRBAG"",""HOCKEY"",""PUMPKIN""]","2018-10-15 14:38:00","8006"
"AYO97APRSEJFA","cs_wg_rev_conf_v2_real1","36AHBNMV1RDYTE6S6UILQB41E1XYD6","1883958","2813708","Female","1028","Yes","No","NO COMMENTS.",NULL,NULL,NULL,NULL,"[""GRENADE: oNE TIME I HEARD THE SOUND OF GRENADE"",""TOMATO:I LIKE TO EAT TOMATO"",""WIZARD:WHEN I GOT NEW MOBILE I WAS WIZARD"",""PALACE:I LIKE TO LIVE IN THE PALACE"",""PUMPKIN:I LIKE PUMBKIN VERY MUCH"",""VOLCANO: I HEARD ABOUT THE VOLCANO, IT WILL FIRE AT ANY TIME."",""SUNBURN:FOR SUNBURN WE HAVE TO EAT MORE FRUITS."",""NAPAKIN:IT IS USED FOR CLEANING."",""CHICKEN:I LIKE TO EAT CHICKEN VERY MUCH."",""COWBOY:COWBOY ALWAYS A PLAYBOY, HE IS NOT SERIOUS."",""CANCER: CANCER IS A VERY DANGEROUS DISEASE."",""BICYCLE: IN MY SCHOOL DAYS I RIDE A THE BICYCLE.""]","["" GRENADE:IT WILL BURN THE THINGS."",""TOMATO: I LIKE TOMATO."",""WIZARD:WHEN I GOT A NEW BIKE I WAS WIZARD."",""PALACE:I LIKE TO LIVE IN THE PALACE"",""CHICKEN:I LIKE TO EAR CHICKEN VERY MUCH"",""BICYCLE: IN THE SCHOOL DAYS I RIDE BICYCLE."",""CANCER: CANCER IS A NOT CURABLE DISEASE."",""PUMPKIN:I LIKE TO EAT PUMPKIN"",""VOLCANO, \nSUNBURN,\n NAPKIN, \nCHICKEN, \nCOWBOY, \nCANCER\nSUNBURN:TO CURE SUNBURN WE MUST EAT FRUITS VERY MUCH."",""NAPKIN:IT IS USED FOR CLEANING."",""VOLCANO:IT WILL BURN ANY TIME."",""COWBOY:HE IS ALWAYS A PLAY BOY.""]","2018-10-15 14:39:01","8007"
"A3CULZ13ZQXBLJ","cs_wg_rev_conf_v2_real1","3T111IHZ5ERDTNHPGJLPWJSEKTDR9Q","389518","1319532","Female","642","No","No","Just thought about the words",NULL,NULL,NULL,NULL,"[""GROUND - I plant my veggies in the ground."",""Baker-Being a baker would be a delicious job. "",""AVOCADO - I like to put an avocado on my sandwich."",""MONKEY - tHAT MONKEY IS SO CUTE."",""Napkin Please wipe your mouth with the napkin.""]","[""Monkey"",""ground"",""Avacodo"",""baker"",""napkin""]","2018-10-15 14:39:52","8008"
"A3SD02HCW68EUL","cs_wg_rev_conf_v2_real1","3FE2ERCCZX9VOX5G5G0IOENOEA0OPY","133132","669946","Female","1047","Yes","No","That was an extremely hard task.",NULL,NULL,NULL,NULL,"[""PALACE"",""PENGUIN"",""BLANKET"",""GRENADE"",""BICYCLE"",""ACROBAT"",""VOLCANO"",""PELICAN"",""DONKEY"",""AVOCADO"",""POTATO"",""CRICKET""]","[""Avocado"",""Can't remember"",""Can't remember"",""Can't remember"",""Can't remember"",""Can't remember"",""Can't remember"",""Can't remember"",""Can't remember"",""Can't remember"",""Can't remember"",""CRICKET""]","2018-10-15 14:41:10","8009"
"A5WSMU54D02XN","cs_wg_rev_conf_v2_real1","3DBQWDE4Y6Z9D2NLKMRRBJI2X0VN5X","428666","1502477","Male","1248","Yes","No","I was just trying to remember a word quick enough.",NULL,NULL,NULL,NULL,"[""PALACE: I would love to live in a big palace."",""TOMATO: I love eating tomatos"",""PELICAN: The pelican has a big mouth."",""WHISKER: The cat has many whiskers."",""PENGUIN: Penguins live in the south pole."",""VOLCANO: The volcano was erupting."",""AIRBAG: The airbag saved my life."",""DONKEY: The donkey has an attitude problem."",""ACROBAT: The acrobat did many tricks."",""HOCKEY: Canada loves hockey."",""CANCER: Cancer is evil."",""LIZARD: Alex Jones hates lizard people.""]","[""Hockey"",""Lizard"",""Cancer"",""Palace"",""Can't remember"",""Can't remember"",""Can't remember"",""Can't remember"",""Can't remember"",""Can't remember"",""Can't remember"",""Can't remember""]","2018-10-15 14:42:58","8010"
"A1HAOXJVRYT43K","cs_wg_rev_conf_v2_real1","3L2IS5HSFAJQYHD0LNZZJVAIWHZNUQ","401465","1465683","Male","1181","Yes","No","I thought this was a fun study. I'm not sure if I had a strategy for the 'third-to-last' letter question, I just tried my best.",NULL,NULL,NULL,NULL,"[""Potato: I like baked potatoes."",""Cowboy: I had a cowboy costume."",""Baker: I wanted to be a baker when I was older."",""Pumpkin: I carved a pumpkin last year."",""Lizard: I think lizards are cool."",""Avocado: I don't like avocados"",""Palace: I've seen Disney's palace."",""Acrobat: I have watched acrobats."",""Airbag: I've had an airbag come out on me."",""Whisker: I have a cat and he likes his whiskers rubbed."",""Sunburn: I get sunburns easily."",""Wizard: my kids pretend to be wizards and it's cute.""]","[""Sunburn"",""Potato"",""Whisker"",""Wizard"",""Cowboy"",""Baker"",""Pumpkin"",""Palace"",""Avocado"",""Lizard"",""Acrobat"",""Airbag""]","2018-10-15 14:43:26","8011"
"A35JIQGE3V7YIC","cs_wg_rev_conf_v2_real1","3UWN2HHPUY6AJ4LWWI4Z4USUBKESNF","381159","1348440","Male","1288","No","No","I had no strategy, tried to remember the words, but most of them had the letter 'a' as the third last, ugh.

Was a very interesting study, I'd be happy to contribute and assist with more of these!",NULL,NULL,NULL,NULL,"[""volcano: I remember the hawaii volcano erupting"",""grenade: remember captain america jumping on one prior to becoming strong"",""squid: I don't enjoy eating it"",""avocado: my wife loves it"",""wizard: my kind of fantasy role playing character"",""cancer: bad disease"",""napkin: my son uses too many"",""acrobat: i don't enjoy watching them, but they are strong"",""banana: my son calls them banna"",""bicycle: i have them, rarely ride them anymore"",""chicken: healthier than beef"",""cookie: avoid, but so delicious""]","[""banana"",""cookie"",""grenade"",""avocado"",""chicken"",""squid"",""wizard"",""can't remember"",""can't remember"",""can't remember"",""can't remember"",""can't remember""]","2018-10-15 14:44:35","8012"
"A2HTH6HQ4C5945","cs_wg_rev_conf_v2_real1","3IXEICO792K3RJSJM1N8CO2UIDS6TX","235106","915462","Male","1104","Yes","Yes","no",NULL,NULL,NULL,NULL,"[""COWBOY"",""NAPKIN"",""AVOCADO"",""BICYCLE"",""TOMATO"",""LIZARD"",""LIQUID"",""POTATO"",""HOCKEY"",""MONKEY"",""AIRBAG"",""CANCER""]","[""COWBOY"",""NAPKIn"",""avocadd"",""BICYCLe"",""tomato"",""lizard"",""liquid"",""potato"",""hockey"",""money"",""airbag"",""cancer""]","2018-10-15 14:45:47","8013"
"A3AAIJP16BGUIN","cs_wg_rev_conf_v2_real1","3EJJQNKU9R668TZ8EV9H90Q236NRHI","535073","1437728","Female","1255","No","No","I never wrote down an answer.  I was trying to remember the words and got flustered.",NULL,NULL,NULL,NULL,"[""It looks like a grenade went off in my house."",""I plan on buying a pumpkin for my daughter."",""I haven't ridden a bicycle in years."",""I don't know anyone who is a cowboy."",""My son has a banana almost every morning."",""My aunt's house looks like a palace."",""I think the pelican is an interesting and ugly bird."",""My purse acts a lot like a trash bucket sometimes."",""My breasts look like deflated airbags."",""I love to eat avocado."",""I can never have enough napkins in my house."",""My son sometimes waddles like a penguin.""]","[""penguin"",""pelican"",""bucket"",""airbag"",""grenade"",""cowboy"",""bicycle"",""can't remember"",""can't remember"",""can't remember"",""can't remember"",""can't remember""]","2018-10-15 14:46:09","8014"
"A12H4QENEVBRSB","cs_wg_rev_conf_v2_real1","3VNXK88KKCJ5MUY6P3QZXGHH5ZG9VR","641025","1780065","Female","1274","No","No","I didnt even have time to answer the 3rd to the last letter - ughs",NULL,NULL,NULL,NULL,"[""CHICKEN:  I love eating chicken"",""WIZARD:  Harry Potter was a wizard"",""CANCER:  Ugh I had cancer"",""BANANA:  I bought banana chips this weekend.  "",""POTATO:  I hate mashed poatoes"",""BUCKET:  i ONCE HAD A BLACK BUCKET"",""BASKET:  My Easter basket is pink"",""SQUID:  Squid is chewy"",""BICYCLE:  My bicycle is silver"",""GRENADE:  I once had a grenade water balloon.  "",""AIRBAG:  Pearl has an airbag."",""VOLCANO:  I once saw volcano ash from Mt St Helen""]","[""VOLCANO"",""BASKET"",""BICYCLE"",""BANANA"",""CANCER"",""SQUID"",""GERNADE"",""AIRBAG"",""potato"",""Can't remember'"",""Can't remember'"",""Can't remember'""]","2018-10-15 14:47:19","8015"
"A2YR34IWZOBQL5","cs_wg_rev_conf_v2_real1","3QIYRE09Y3IAPKM2JZPF8T5LLK11N4","835604","1892916","Female","1228","No","No","Trying to think of all the words",NULL,NULL,NULL,NULL,"[""I once saw a pelican."",""I've never been in a palace."",""Bananas are good. "",""Cats have whiskers"",""I've seen a donkey."",""I store things in baskets."",""I have a bicycle."",""I don't know anything about being a cowboy."",""I've seen an acrobat preform before."",""I've never held a grenade."",""I own a blouse."",""I like lizards.""]","[""banana"",""basket"",""bicycle"",""blouse"",""grenade"",""acrobat"",""cowboy"",""lizard"",""palace"",""can't remember"",""can't remember"",""can't remember""]","2018-10-15 14:50:54","8016"
"A3HMCMIGXMPNXS","cs_wg_rev_conf_v2_real1","3MHW492WW0EKTEH0ECU422N15YYVMN","691286","1799568","Male","1267","No","No","To not pick a word with 'a' as the letter.",NULL,NULL,NULL,NULL,"[""GRENADE - Sounds like Grenada which is a place there was a military action I remember hearing about when I was in high school."",""COWBOY - I like 'cowboy' cookies."",""PELICAN - I read John Grisham's 'Pelican Brief'."",""BLANKET - I will make a blanket denial of any accusations made about me regarding money laundering."",""CHICKEN - Chicken is another term for coward."",""ROCKET - This definitely isn't rocket science."",""CANCER - Advertising is a cancer on our culture."",""ADULT - I didn't feel like an adult until I was 30."",""BICYCLE - Bicycles remind me of banana seats which I always thought sounded funny."",""VOLCANO - Volcanoes kick ass."",""AVOCADO - Avocado trees are deadly."",""BANANA - I liked the show 'Banana Splits' when I was a kid.""]","[""banana"",""bicycle"",""volcano"",""cowboy"",""avacado"",""Can't remember"",""Can't remember"",""Can't remember"",""Can't remember"",""Can't remember"",""Can't remember"",""Can't remember""]","2018-10-15 14:56:42","8017"
"ASWFEKZ0JVDYK","cs_wg_rev_conf_v2_real1","3WT783CTPBISBE73W69QYUOI8S7CB9","2222474","3141997","Female","1235","Yes","No","IT IS VERY LITTLE TIME",NULL,NULL,NULL,NULL,"[""POTATO:MY MOTHER LOVES FRIED POTATOES"",""THUMB:A FEW YEARS AGO FRACTURE OF THUMB PLAYING WITH MY BROTHERS"",""DONKEY:ON MY TRIP TO MEXICO I KNOWN DONKEY CALLED RAMOS WAS VERY JUST"",""PALACE:ALWAYS FROM GIRL I WANTED TO LIVE IN A PALACE AS A PRINCESS"",""BLANKET:MY RED BLANKET IS MY FAVORITE"",""BICYCLE:I LIKE A LOT TO EXERCISE ME IN THE BICYCLE"",""COOKIE:MY DAUGHTER LOVES THE GRANOLA COOKIES"",""WIZARD:I LIKE MUCH MAGIC, I INTRIGUE EVERYTHING YOU HAVE TO LEARN A MAGICIAN"",""BANANA:THE PERFECT BANANA BREAKFAST WITH BIG WAVE"",""COWBOY:THE JEALOUS FILMS MY FATHER LIKED A LOT"",""GRENADE:THEY ARE VERY LEGEROUS, I'M AFRAID"",""VOLCANO:THEY ARE AWESOME, IT IS SEEING THE EARTH WITH LIFE""]","[""PATATO"",""BLANKET"",""BIKE"",""COOKIES"",""DONKEY"",""'Can't remember"",""'Can't remember"",""'Can't remember"",""'Can't remember"",""'Can't remember"",""GRENADE"",""VOLCANO""]","2018-10-15 14:59:18","8018"
"AKC8JY7GD16E1","cs_wg_rev_conf_v2_real1","3B3WTRP3DB3WP3041T6OVBK681S92O","335926","1202029","Female","1226","Yes","No","Fizzle? I thought that was just a practice question",NULL,NULL,NULL,NULL,"[""I don't care for hockey"",""I hope I don't ever get cancer"",""I want to go pumpkin picking"",""I enjoy harry potter a story about a wizard"",""I wish I lived in a palace"",""I wonder about the times square naked cowboy sometimes"",""I hope my airbag functions properly"",""I'll probably never be an acrobat"",""I'd like to think I'm an adult"",""I should pick up a tomato at the grocery later"",""I find riding donkeys to be terribly sad"",""I don't like lizards""]","[""hockey"",""wizard"",""pumpkin"",""cancer"",""acrobat"",""palace"",""adult"",""tomato"",""can't remember"",""can't remember"",""can't remember"",""can't remember""]","2018-10-15 15:00:57","8019"
"A3NMU5T103ZCNC","cs_wg_rev_conf_v2_real1","3YT88D1N08Z5RHFE9QBI4U3EP9J3K2","400099","1194999","Female","633","No","No","I said each word in my head and listened for sounds that come from letters late in the alphabet. ",NULL,NULL,NULL,NULL,"[""DONKEY: I enjoy petting donkey at a petting zoo."",""WHISKER: Sometimes while I'm cleaning the house I find a cat whisker."",""HOCKEY: One sport I don't understand the appeal of is hockey."",""HOUSE: I enjoy home improvement projects in my house."",""CANCER: My grandma died of cancer when I was a toddler.""]","[""Donkey"",""Whisker"",""Can't remember"",""House"",""Cancer""]","2018-10-15 15:03:58","8020"
