"subject","version","assignmentId","instructions_time","total_time","gender","s1_bonus","use_s1","write_down","comments","tr_choices","tr_rt","tr_resp","tr_resp2","tr_resp_correct","tr_resp2_correct","stamp","id"
"A266LEEGUGH432","cs_wg_rev_conf_v2_real1","351SEKWQS0IYZXHENRUAWGHU2QHDMO","177336","992610","Female","625","No","No","I wrote all of the words down first and then I just remembered my strategy from the first part, which was to remember the highest scoring and lowest scoring words. There were 2 words with the same value. Once I remembered that, the values came back to me pretty easily.",NULL,NULL,NULL,NULL,"[""WHISKER: I saw a cat with one whisker once."",""CRICKET: There was a cricket in the apartment the other day."",""HOUSE: I want to live in a house."",""GRENADE: I hate that Bruno Mars song Grenade."",""CHICKEN: I love to eat chicken.""]","[""grenade"",""chicken"",""cricket"",""house"",""whisker""]","2018-10-05 16:29:51","7915"
"A1KX0MPSHBMRB9","cs_wg_rev_conf_v2_real1","3TGOYF991XN3T7X9IOBLXQ2C1CJUUB","162611","907036","Female","626","No","No","I really had no strategy.  My brain was hurting and I just tried to think of a word.  Thank you.",NULL,NULL,NULL,NULL,"[""Potato"",""Thumb"",""Rocket"",""Chicken"",""Donkey""]","[""Chicken"",""Donkey"",""Thumb"",""Crumb"",""Can't remember""]","2018-10-05 16:35:15","7916"
"A3F1TKU374CF9L","cs_wg_rev_conf_v2_real1","36PW28KO4ZX2P2MPMJFPT74F8L2EA7","297193","915121","Female","1036","Yes","No","I just did the best I could to answer. ",NULL,NULL,NULL,NULL,"[""I use a napkin at dinner"",""I have never tried squid"",""I have caught a lizard before in the woods"",""I have read the Wizard of Oz"",""I eat a banana every day"",""I use a bucket to scrub my floors"",""I have visited a palace before"",""I ate tomato soup for lunch today"",""My dad has used a hand grenade before "",""I live where it's easy to find a cowboy"",""I use a basket to store my crafts"",""I have had the airbag deploy in my car before""]","[""tomato"",""wizard"",""lizard"",""napkin"",""grenade"",""palace"",""airbag"",""can't remember"",""can't remember"",""can't remember"",""can't remember"",""can't remember ""]","2018-10-05 16:40:29","7917"
"A13685BFTHLRBB","cs_wg_rev_conf_v2_real1","3U84XHCDICELY8X495JB1EJX4H64ZJ","468672","1470087","Male","1270","No","No","I by mistake wrote Lizard on the virtual notepad part. My strategy was to visit the palace I created.",NULL,NULL,NULL,NULL,"[""I clean my hands with a napkin."",""I eat tomato every morning."",""My car has one airbag."",""I eat a lot of cookies."",""The state I live in is called Cowboy's State."",""My palace is my kingdom."",""Lizard or chameleon?"",""Water is a liquid."",""I like avocado salad."",""A friend of mine has a cancer."",""Counter strike game has grenades."",""Nasa sends rockets.""]","[""Cancer"",""Avocado"",""Airbag"",""Napkin"",""Grenade"",""Lizard"",""Liquid"",""Tomato"",""Cowboy"",""Cant remember"",""Cant remember"",""Cant remember""]","2018-10-05 16:42:50","7918"
"A1HN2V46HTHYT5","cs_wg_rev_conf_v2_real1","3QAVNHZ3EM5GV8WH352T62UZHHSALD","236370","1091034","Female","635","No","No","I typed out all the words but i couldn't think of skunk ",NULL,NULL,NULL,NULL,"[""SKUNK: I saw black and white skunk."",""CRICKET: There was a cricket in our garden."",""PALACE: When I was younger, I dreamed of living in a palace. "",""PUMPKIN: We found three large pumpkins to carve. "",""CHICKEN: I love to eat chicken. ""]","[""pumpkin"",""chicken"",""palace"",""skunk "",""cricket""]","2018-10-05 16:49:29","7919"
"AXAF4OJOJ4P6I","cs_wg_rev_conf_v2_real1","3HOSI13XHZPVV3B1AYV7DQU0TC7DDO","161732","877211","Female","595","Yes","No","no :)",NULL,NULL,NULL,NULL,"[""Hockey"",""Market"",""Squid"",""Rocket"",""Lizard""]","[""Lizard"",""Hockey"",""cant remember"",""cant rememeber"",""cant rememeber""]","2018-10-05 16:51:04","7920"
"A2RYADTQSNGAE1","cs_wg_rev_conf_v2_real1","3Y9N9SS8LYCXDB94H9PV0H8O2ZP3DN","231648","983553","Female","634","No","No","During the first round, I made sure to make a list in my head of highest point word to lowest point word. ",NULL,NULL,NULL,NULL,"[""Squid: I have never eaten squid before."",""Donkey: There was a character called Donkey Kong."",""Lizard: I spotted a lizard in front of the place we were staying in Tennessee."",""Chicken: Chicken is one of my favorite things to eat."",""Cricket: I think I have a cricket living in my walls currently. ""]","[""Squid"",""Lizard"",""Donkey"",""Chicken"",""Cricket""]","2018-10-05 17:01:53","7921"
"AS725SD8X6JR4","cs_wg_rev_conf_v2_real1","3IO1LGZLK9YKTZ0VJ3CDLS671YB685","655745","1902964","Female","1260","No","No","don't know, too little time",NULL,NULL,NULL,NULL,"[""lizard, I had one as a child"",""hockey, never played, or liked it"",""grenade, wish I had one"",""potato, cook them a lot"",""cricket. too noisy"",""chicken, like to eat it"",""cancer, hope I never get it"",""wizard, of oz, one of my favorite movies"",""palace, would like to live in one"",""ground, try to stay on it"",""avocado, like to make a facial out of it"",""banana, like to make pudding out of them""]","[""banana"",""avocado"",""lizard"",""chicken"",""potato"",""cricket"",""hockey"",""ground"",""cancer"",""grenade"",""can't remember"",""can't remember""]","2018-10-05 17:05:35","7922"
"A2MX5YW3DSQ61W","cs_wg_rev_conf_v2_real1","3WR9XG3T63C2EYRYQARSAUQYUOG47E","428235","1360481","Female","641","No","No","I wrote the first word that came to my mind.",NULL,NULL,NULL,NULL,"[""AVOCADO: I ate an avocado."",""PUMPKIN: I want to bake pumpkin muffins."",""SQUID: Squidward is a squid."",""NAPKIN: I used a napkin."",""BLANKET: My blanket has seashells on it.""]","[""AVOCADO"",""PUMPKIN"",""SQUID"",""NAPKIN"",""BLANKET""]","2018-10-05 17:05:41","7923"
"A2E746SZEOVYXS","cs_wg_rev_conf_v2_real1","3NS0A6KXC491AOQO46LCA3G0UM1ZGN","245458","1021072","Male","635","No","No","write down the words I remembered and look at the third to last letter.",NULL,NULL,NULL,NULL,"[""PENGUIN: I like to see the penguin at the zoo."",""ROCKET:  I enjoy working on a model rocket."",""NAPKIN:  I use a napkin when I eat."",""BUCKET:  I put tools in a bucket in my garage."",""GRENADE:  I have never witnessed a grenade being used in my life.""]","[""Penguin"",""Grenade"",""Bucket"",""Napkin"",""Rocket""]","2018-10-05 17:06:16","7924"
"AVF39CMHUZBTJ","cs_wg_rev_conf_v2_real1","3Z2R0DQ0JHFDKZRL94MANPLHWW82EK","651891","1940330","Female","1273","No","No","I tried to remember some words based on my photo memory but I did not have enough time.",NULL,NULL,NULL,NULL,"[""CRICKET: I do not not have to play"",""ACROBAT: I wish I was an acrobat"",""WHISKER: I do not like them"",""GRENADE: Not being hit by one"",""VOLCANO: I have a ring from volcano stone"",""AIRBAG: Safety first"",""CANCER: Hope to never have one"",""COWBOY: Reminds me of Texas where I live"",""DONKEY: Cartoon character from Winnie the Pooh"",""GROUND: I prefer ground than skies"",""PALACE: I wish I was a princess living in palace"",""LIZARD: One of my favorite poses in yoga""]","[""PALACE"",""AIRBAG"",""LIZARD"",""DONKEY"",""CANCER"",""CRICKET"",""WHISKER"",""GRANADE"",""Can't remember"",""Can't remember"",""Can't remember"",""Can't remember""]","2018-10-05 17:06:18","7925"
"A2O9DUB2SSHAX5","cs_wg_rev_conf_v2_real1","39U1BHVTDLS4U0513ZPA5LQA5LD3T6","277555","1270409","Female","642","No","No","U WAS CLOSET TO THE END OF THE ALPHABET SO I CHOOSE SEAGULL",NULL,NULL,NULL,NULL,"[""SEAGUL: I ONCE FED A SEAGULL"",""BUCKEY: I FILLED A BUCKET WITH SAND"",""DONKEY: I AM SCARED OF A DONKEY"",""BICYCLE: I LOVE RIDING MY BICYCLE"",""ROCKET: I WATCHED A VIDEO OF A ROCKET LAUNCH""]","[""SEAGULL"",""BUCKET"",""DONKEY"",""BICYCLE"",""ROCKET""]","2018-10-05 17:07:28","7926"
"A1LNYJ21DDUG6I","cs_wg_rev_conf_v2_real1","33LKR6A5KEL8KXRMGVBRHSBD711T16","346861","1136247","Female","629","No","No","I blanked on what all of my words were and could not think about them or type them fast enough for the time given but with a little more time, I think I could have got it.",NULL,NULL,NULL,NULL,"[""POTATO: I NEED TO GO TO THE STORE AND BUY A POTATO."",""CRICKET: MY FRIEND ONCE ATE A CRICKET IN A LOLLIPOP."",""MONKEY: MY GRANDMA IS BORN THE YEAR OF THE MONKEY."",""THUMB: I DO NOT HAVE A GREEN THUMB."",""PUMPKIN: I LOVE PUMPKIN PIE.""]","[""potato"",""cricket"",""monkey"",""thumb"",""pumpkin""]","2018-10-05 17:08:01","7927"
"A1MPBC4R584DC6","cs_wg_rev_conf_v2_real1","3QY5DC2MXRLEAP0JNZGMBQ19RPMUFU","576272","1678187","Female","1283","No","No","I didn't really have one.  I just remembered cricket and felt K was somewhere in the middle.  Given the time constraint, and my difficulty in remembering and concentrating on stuff, I couldn't remember the rest of the words at the time.",NULL,NULL,NULL,NULL,"[""WHISKER: Cats have whiskers."",""SKUNK: Skunks have a pervasive smell that just won't go away."",""BLANKET: It's cold and I'm wrapped up in a blanket right now."",""PELICAN: The pelican said, \""Get in my mouth if you want to live.\"""",""ACROBAT: Adobe Acrobat is old."",""VOLCANO: Volcanoes are hot and I hope I never go near one."",""AVOCADO: Avocados are delicious and I miss how one house I lived in had an avocado tree in the backyard."",""LIZARD: I saw a tiny lizard in the house a few weeks ago."",""CRICKET: Crickets are kinda ugly."",""POTATO: Potatoes are delicious, unless they're green."",""TOMATO: Tomato is just in this list to be confusing with potato, isn't it."",""BICYCLE: Why are bicycle seats so uncomfortable?""]","[""bicycle"",""tomato"",""potato"",""avocado"",""volcano"",""lizard"",""blanket"",""skunk"",""whisker"",""Can't remember"",""Can't remember"",""Can't remember""]","2018-10-05 17:09:53","7928"
"A3LIGKBGW5XVCK","cs_wg_rev_conf_v2_real1","3TEM0PF1Q5Y1WJA7YM7CYJAHZNK0D4","2127651","3130159","Female","605","Yes","No","no",NULL,NULL,NULL,NULL,"[""I like to use a napkin"",""I use basket for my fruit"",""Im tired of being a adult"",""Love to eat cookies out from the oven"",""I would like to see a volcano sometime""]","[""volcano"",""cookie"",""napkin"",""basket"",""adult""]","2018-10-05 17:10:51","7929"
"A1GIYCSZZCQ98I","cs_wg_rev_conf_v2_real1","392CY0QWG1SZ3I8U91VP1JG784UI4Q","552916","1481868","Male","1053","Yes","Yes","no",NULL,NULL,NULL,NULL,"[""PELICAN"",""PUMKIN"",""CRICKET"",""JAGUAR"",""AVOCADO"",""BANANA"",""BICYCLE"",""TOMATO"",""ROCKET"",""COWBOY"",""GRENADE"",""ACROBAT""]","[""PUMPKIN"",""BANANA"",""acrobat"",""can't remember"",""can't remember"",""can't remember"",""can't remember"",""can't remember"",""can't remember"",""can't remember"",""can't remember"",""can't remember""]","2018-10-05 17:13:20","7930"
"APQ4BQEA1647S","cs_wg_rev_conf_v2_real1","3J4Q2Z4UTY4OTIFXWF6H5DQKJ7BQWO","361551","1493500","Female","1267","Yes","No","none",NULL,NULL,NULL,NULL,"[""palace. i think im a queen"",""lizard. i think there are reptillian lizards on earth"",""hockey. i once went to a hockey game and was bored out of my mind"",""grenade. my exhusband was a marine who shot grenades in iraq"",""napkin. i waste napkins like there is no tomorrow"",""cancer. my father has prostate cancer"",""airbag. the airbag sensors in my car are broken"",""bicycle. i havent ridden one of these in years"",""cookie. my favorite cookie is oatmeal raisn"",""potato. ive researched that the healtlhiest potato is the sweet potatoe"",""penguin. my kids favorite cartoon is pingu the penguin"",""tomato. tomatoes give me heartburn""]","[""tomato"",""cookie"",""palace"",""lizard"",""bicycle"",""cancer"",""napkin"",""potatoe"",""hockey"",""grenade"",""airbag"",""penguin""]","2018-10-05 17:13:38","7931"
"A2N0FUQBDQRBN5","cs_wg_rev_conf_v2_real1","31UV0MXWNQDHZ1CUN6EZ6BML80H5IA","363754","1528074","Male","1271","Yes","No","No strategy. Adult was the first word I thought of.",NULL,NULL,NULL,NULL,"[""I carved a pumpkin for Halloween."",""I put avocado in the Sushi I made."",""I threw a grenade in Call of Duty."",""I read about a volcano potentially erupting."",""I once had a pet lizard."",""I occasionally eat a baked potato."",""I am an adult."",""The fruit smoothie I make always contains a banana."",""I watched a documentary on National Geographic about a monkey."",""My grandmother died of breast cancer."",""I have a basket in which I put my multimedia accessories."",""I do not have the agility to be an acrobat.""]","[""pumpkin"",""avocado"",""cancer"",""grenade"",""volcano"",""lizard"",""acrobat"",""basket"",""adult"",""banana"",""potato"",""monkey""]","2018-10-05 17:14:00","7932"
"AUFEIF3EGRO2C","cs_wg_rev_conf_v2_real1","3XLBSAQ9Z4DIHVFNB3HI4Q37VJJZ7L","286593","1199353","Male","1280","No","No","I just started thinking of words, checking how close it was to the end, and comparing it to the next word I could think of.",NULL,NULL,NULL,NULL,"[""ROCKET: I once made a bottle rocket"",""TOMATO: I don't really like tomatoes"",""BANANA: My favorite fruit is a banana."",""CRICKET: I feed my lizard crickets"",""POTATO: I love baked potatoes"",""HOCKEY: I watched a hockey game fight"",""LIZARD: I have a pet lizard"",""ACROBAT: I used to pole vault"",""AIRBAG: I've never been in an accident"",""SAUCE: I love BBQ sauce"",""COWBOY: Inside joke between my friends"",""AVOCADO: I love making guacamole""]","[""ROCKET"",""AVOCADO"",""LIZARD"",""CRICKET"",""HOCKEY"",""TOMATO"",""POTATO"",""SAUCE"",""ACROBAT"",""Can't remember"",""Can't remember"",""Can't remember""]","2018-10-05 17:14:10","7933"
"A3A00UKGHIRCPO","cs_wg_rev_conf_v2_real1","3U8YCDAGXPHVLSEC38DWYIHGI2X0QX","474932","1413750","Female","642","No","No","No strategy, just guesses. At this point I am completely lost.",NULL,NULL,NULL,NULL,"[""MONKEY: I saw a monkey on TV last night."",""BASKET: I used a basket to hold my yarn."",""AIRBAG: An airbag could save your life."",""DONKEY: A donkey can be found on a farm."",""PENGUIN: A penguin waddles when it walks.""]","[""BASKET"",""PENGUIN"",""DONKEY"",""Can't remember"",""Can't remember""]","2018-10-05 17:14:20","7934"
"AIAYF4BQXCLDPX","cs_wg_rev_conf_v2_real1","3IRIK4HM3ALM52Q80FSINE2QRQGC63","368960","1416219","Male","435","No","No","NOPE",NULL,NULL,NULL,NULL,"[""CRICKET"",""TOMATO "",""LIQUID "",""PUMPKIN"",""BAKER""]","[""CRICKET"",""TOMATO"",""LIQUID"",""PUMPKIN"",""BAKER""]","2018-10-05 17:14:34","7935"
"AIVSV91CBYI12","cs_wg_rev_conf_v2_real1","3C2NJ6JBKAIHE54Y23PTDCFQAPL2NN","1038916","2394847","Female","1210","No","Yes","I was so frazzled by this HIT but thoroughly enjoyed it. The only word I could think of for the ""third to last"" question was BASKET so I picked K.",NULL,NULL,NULL,NULL,"[""AVOCADO: I like to eat avocado's."",""SCUBA: I can't swim so scuba diving is out."",""CANCER: My father, step-father and grandfather had cancer."",""PUMPKIN: I love Sweet Cinnamon Pumpkin liquid soap."",""GRENADE: I love Bruno Mars song \""Grenade\""."",""COWBOY: I once had a horse named Cowboy Quincy Dan"",""BANANA:I like bananas."",""ACROBAT:I like to watch an acrobat perform."",""NAPKIN: I never remember to put the cloth napkin on my lap at a fancy restaurant."",""TOMATO: I love home grown tomatos."",""BASKET: I loved getting an Easter basket when I was a kid."",""LIZARD: Lizards are like small dinosaurs.""]","[""tomato"",""lizard"",""avocado"",""banana"",""basket"",""scuba"",""grenade"",""can't remember"",""can't remember"",""can't remember"",""can't remember"",""can't remember""]","2018-10-05 17:17:52","7936"
"A2KULPQLIRYC9D","cs_wg_rev_conf_v2_real1","3F0BG9B9MPOIC55IFHFZQJU5PPJY7X","338608","1698900","Male","1272","No","No","My strategy was on the third to last letter question was to go with intuition. The first word that popped to my mind was ""liquid."" a Q seemed decent. Now I see i should have gone with ""Wizard"" or ""Lizard."" Oh well.",NULL,NULL,NULL,NULL,"[""LIQUID: A liquid diet is effective."",""GRENADE: I lobbed a grenade at the enemy."",""PUMPKIN: Nothing quenches thirst like pumpkin ale."",""WIZARD: Harry Potter is a wizard."",""BANANA: I have bananas growing in the back yard."",""LIZARD: Lizards in my yard eat roaches."",""AVOCADO: Avocado toast is a weird idea."",""HOCKEY: Lot of fighting in hockey."",""BICYCLE: They rode a bicycle built for two."",""POTATO: We ate potatoes and eggs."",""PALACE: It wasn't a palace, but it would do."",""BAKER: I'd be a baker if it paid better.""]","[""LIQUID"",""PUMPKIN"",""WIZARD"",""LIZARD"",""AVOCADO"",""POTATO"",""BANANA"",""GRENADE"",""PALACE"",""BICYCLE"",""BAKER"",""Can't remember""]","2018-10-05 17:17:59","7937"
"AQ4L7ICTGOJ3O","cs_wg_rev_conf_v2_real1","3JC6VJ2SABK2TJTWBIMMPDY2VSH5AB","756785","2260235","Male","1270","No","No","This was a great study! I really hope to do more studies like this in the future. My general strategy for the third-to-last letter question was to just think about the words that have the third-to-last letter come after t. I consider the letter ""t"" and all the ones that come after as very late letters.",NULL,NULL,NULL,NULL,"[""COWBOY: I watched the Dallas Cowboys football team play last week."",""AIRBAG: I have an airbag in my car."",""VOLCANO: I saw a volcano erupt in Hawaii on TV."",""PENGUIN: I have seen a penguin in an Antartica documentary."",""BANANA: I ate a banana today."",""ROCKET: I like reading about space rockets."",""DONKEY: I have never owned a donkey."",""CANCER: I am not diagnosed with cancer."",""WIZARD: I would like to be a wizard someday."",""TOMATO: I like tomatoes in my burgers."",""BASKET: I used a shopping basket in the store today."",""BICYCLE: I have not rode my bicycle for a year.""]","[""Bicycyle"",""Penguin"",""Banana"",""Rocket"",""Cowboy"",""Tomato"",""Donkey"",""Cancer"",""Wizard"",""Airbag"",""Can't Remember"",""Can't Remember""]","2018-10-05 17:20:52","7938"
"A398JDNJIP7ERA","cs_wg_rev_conf_v2_real1","3570Y55XZPK15YGJ8KJTWW7YOTEGYW","308573","1088418","Male","642","No","No","I didn't really have a strategy for that question. The time limit had me under pressure lol. I put the first thing that came to mind.",NULL,NULL,NULL,NULL,"[""Banana: I love banana smoothies."",""Blanket: Blankets keep me warm."",""Baker: I want a personal Baker one day."",""Whisker: Dogs and cats have whiskers."",""Skunk: My cousin was sprayed with a skunk when we were little.""]","[""Banana"",""Whisker"",""Skunk"",""Baker"",""Blanket""]","2018-10-05 17:24:59","7939"
"AR8O1107OAW4V","cs_wg_rev_conf_v2_real1","34YB12FSQYP1BHR5PHVI21KRFJ8GME","202907","1204753","Male","642","No","No","Bicycle was the only one without a K, so I avoided it.",NULL,NULL,NULL,NULL,"[""BUCKET, I would put rocks in it as a kid."",""SQUID, They gross me out"",""BICYCLE, I spend a lot of time on one as a kid."",""ROCKET, I love rockets."",""BAKER, My aunt was one.""]","[""BUCKET"",""SQUID"",""BAKER"",""ROCKET"",""BICYCLE""]","2018-10-05 17:42:18","7940"
"AUSNINHJ6SSPI","cs_wg_rev_conf_v2_real1","336YQZE83VF3VK2L8LCRY4T2P9B5M0","322365","1315475","Female","1238","No","No","No it was actually a lot of fun! I panicked on that question and kept thinking of words with third to last letter as 'a'. Didn't pan out for me.",NULL,NULL,NULL,NULL,"[""tomato- fried green tomatoes with salt"",""grenade- world war II"",""potato- mashed potatoes & gravy for Thanksgiving dinner"",""rocket- 4th of July celebrations"",""wizard- Harry Potter movies"",""banana- warm banana bread"",""pumpkin- October & Halloween!"",""acrobat- I've always wanted to see the acrobats at the circus"",""cowboy- the rodeo at country fairs"",""bicycle- I enjoy going for bike rides around the city"",""sauce- making new sauces for dinner"",""Whisker- My cats both have long whiskers""]","[""whisker"",""sauce"",""banana"",""acrobat"",""cowboy"",""grenade"",""bicycle"",""tomato"",""pumpkin"",""wizard"",""potato"",""can't remember""]","2018-10-05 17:42:23","7941"
"A1HAPRSTVPPZNM","cs_wg_rev_conf_v2_real1","3SKRO2GZ71S9HE1ZMMXZG1OHOP3K1M","432338","1087677","Male","1039","Yes","Yes","GOOD",NULL,NULL,NULL,NULL,"[""HOCKEY"",""THUMB"",""COWBOY"",""CRICKET"",""POTATO"",""BICYCLE"",""DONKEY"",""TOMATO"",""BANANA"",""AVOCADO"",""PEICAN"",""ACROBAT""]","[""HOCKEY"",""THUMB"",""COWBOY"",""AVOCADO"",""CRICKET"",""POTATO"",""BICYCLE"",""DONKEY"",""TOMATO"",""BANANA"",""PELICAN"",""ACROBAT""]","2018-10-05 17:58:43","7942"
"A3S5QDW6OU35NH","cs_wg_rev_conf_v2_real1","3MYYFCXHJ38L7R2ZJDVMG73RTS34GN","220994","1008776","Female","594","No","No","The third-to-last letter question was difficult and I do not think I got my answer in on time. Somehow I got caught up on ""monkey"" and ""donkey'- which have the same third-to-ast letter. ",NULL,NULL,NULL,NULL,"[""Tomato: I like salted tomatoes"",""Donkey: the neighbor down the way has a donkey"",""Liquid: most things I drink are liquid"",""Napkin: i am out of napkins at home"",""Monkey: Monkeys are the most hilarious animal. ""]","[""Tomato"",""Donkey"",""Monkey"",""Napkin"",""Liquid""]","2018-10-05 18:06:28","7943"
"A1ZHYS5O0CKLXB","cs_wg_rev_conf_v2_real1","39OWYR0EPKSVRYKOX0DBEB7MNEVFYD","663902","1617370","Female","1262","No","No","To write down all the words I could remember and go from there but I ran out of time!",NULL,NULL,NULL,NULL,"[""Avocado, I love avocados with eggs for breakfast"",""Cowboy, My grandfather used to play cowboys and indians."",""Bicycle, I learned to ride a bicycle when I was young"",""Airbag, The airbag needs to be replaced in my car"",""Chicken, I love chicken strips."",""Rocket, Rocket Man by Elton John in a great song."",""Cancer, My grandma passed from lung cancer"",""Tomato, I do not like tomatoes."",""House, My house is a house, my home is in his arms."",""Palace, I would love to visit the royal palace."",""Whisker, My boyfriends whiskers tickle my cheek."",""Grenade, They use the word Grenade as a reference to an ugly woman on Jersey Shore.""]","[""House"",""Tomato"",""Grenade"",""Palace"",""Whisker"",""Cowboy"",""Cancer"",""Bicycle"",""Avacado"",""airbag"",""chicken"",""Rocket""]","2018-10-05 18:06:56","7944"
"A37FQI6S9XARBT","cs_wg_rev_conf_v2_real1","37TRT2X24QSFJSD96YQCLY1DVCTJB4","601563","1686478","Female","1141","No","No","thank you hope i could remeber i feel so pressured under that but all in alal it was fun thank you",NULL,NULL,NULL,NULL,"[""PALACE- I like to visit a beautiful PALACE"",""THUMB- I once cut my THUMB"",""LIZARD- we have cute LIZARDs out side"",""GRENADE- wars have GRENADE"",""ACROBAT i like to watch the ACROBAT,"","" DONKEY we like the DONKEY"",""VOLCANO, a VOLCANO, erupted in the Philipines"",""PELICAN I seen a PELICAN fly over the peer"",""COOKIE i baked a big cookie"",""CANCER My grandmother died of cancer"",""AVOCADO an AVOCADO is green"",""ROCKET the rocket was fast""]","[""Palace"",""Cancer"",""Avocado"",""rocket"",""pelican"",""cookie"",""volcano"",""Can't remember"",""Can't remember"",""Can't remember"",""Can't remember"",""Can't remember""]","2018-10-05 18:08:37","7945"
"A1I0AQEKVWIPXC","cs_wg_rev_conf_v2_real1","3N1FSUEFL51IV7S8HNUEAM0UG0Q4DG","657564","1726258","Male","1176","No","No","I tried to think of all the words first then think of the letters in them.",NULL,NULL,NULL,NULL,"[""TOMATO: I don't like tomatoes raw"",""VOLCANO: I made baking soda volcanos as a kid."",""COWBOY: Ride 'em"",""SAUCE: I like marinara sauce."",""BANANA: I have a good banana bread recipe."",""PALACE: My cousin's house is big enough to be a palace"",""CANCER: I lost a friend to cancer."",""GRENADE: My mom calls small water bottles grenades."",""MONKEY: I liked curious George growing up."",""MARKET: This town has a good farmers market"",""LIZARD: I had a pet newt for a while."",""CHICKEN:  I love chicken parm.""]","[""tomato"",""chicken"",""palace"",""cancer"",""grenade"",""sauce"",""monkey"",""cowboy"",""can't remember"",""can't remember"",""can't remember"",""can't remember""]","2018-10-05 18:24:38","7946"
"A1K6T4BCZASC50","cs_wg_rev_conf_v2_real1","3IJXV6UZ1XK64OASKDR29CRH0JCIR9","255932","1344876","Male","608","No","No","I visualized the third to last letter in my head to try to remember",NULL,NULL,NULL,NULL,"[""NAPKIN: I use a napkin when I eat"",""HOUSE: I used to live in a house"",""BAKER: Bakers make delicious breads"",""BICYCLE: I enjoy using my bicycle"",""DONKEY: Donkeys are kind of cute""]","[""napkin"",""donkey"",""bicycle"",""house"",""Can't remember""]","2018-10-05 18:27:14","7947"
"A1933MG40PU0XB","cs_wg_rev_conf_v2_real1","3RJSC4XJ10V6S6VEJGPT07MPM7250J","429479","1459048","Male","1199","Yes","No","First one that I remembered was Rocket. This may have something to do with reinforcing the word with a 15 point value.",NULL,NULL,NULL,NULL,"[""I've never visited a volcano."",""The potato is a staple in my diet."",""My care has an airbag."",""I've never wanted to be a cowboy."",""I like the song rocket man."",""I want to ride my bicycle."",""I could use a napkin."",""I need to go to the market."",""My zodiac sign is not cancer."",""Once you pull the pin, Mr. Grenade is not your friend."",""I drink liquid."",""I prefer tomato on my salad.""]","[""tomato"",""potato"",""cowboy"",""rocket"",""bicycle"",""volcano"",""liquid"",""grenade"",""can't remember"",""can't remember"",""can't remember"",""can't remember""]","2018-10-05 18:37:39","7948"
"A3DJJQP3ATMFKP","cs_wg_rev_conf_v2_real1","3LOTDFNYA70R2TPOIZVNTEM6C87FWU","302535","1174877","Female","611","No","Yes","no strategy, just remembered the words and started writing them down",NULL,NULL,NULL,NULL,"[""Pelican-I have never seen a pelican in real life."",""Chicken-I love chicken tenders!"",""House-I live in a small ranch house."",""Baker-I used to want to be a baker."",""Hockey-I don't like the sport of Hockey.""]","[""pelican "",""chicken"",""house "",""baker"",""hockey""]","2018-10-05 20:05:12","7949"
